
Programador/a ABAP;SEIDOR;SEIDOR  España En remoto hace 3 días  24 solicitudes;Jornada completa · Algo de responsabilidad;null;
Programador / Consultor de Microsoft Power Platform;Almato Iberia;Almato Iberia  Barcelona, Cataluña, España En remoto hace 2 meses  127 solicitudes;Jornada completa;null;
Desarrollador de front-end;Softtek;Softtek  España En remoto hace 1 semana  Más de 200 solicitantes;Jornada completa · Intermedio;null;
Angular developer;Essentialist.com;Essentialist.com  España En remoto hace 3 días  86 solicitudes;Jornada completa;Ana Lladó Perelló ;https://www.linkedin.com/in/ana-llad%C3%B3-perell%C3%B3-97a009b9;null;
Analista Programador Java Sector Sanidad (100% remote);Plexus Tech;Plexus Tech  España En remoto hace 1 semana  19 solicitudes;Jornada completa · Algo de responsabilidad;Teresa Burguera Pereira ;https://www.linkedin.com/in/teresaburguerapereira;null;
Back End Developer;PIXIE;PIXIE  España En remoto hace 3 días  31 solicitudes;Contrato por obra · Intermedio;null;
Analista Programador JAVA (Teletrabajo 100%);atSistemas;atSistemas  Cádiz, Andalucía, España En remoto hace 1 semana  61 solicitudes;Jornada completa · Algo de responsabilidad;Leticia Román Gómez ;https://www.linkedin.com/in/leticia-rom%C3%A1n-g%C3%B3mez-5b031120;null;
Técnico de Sistemas Jr;Full On Net;Full On Net  Madrid, Comunidad de Madrid, España En remoto hace 3 días  Más de 200 solicitantes;Jornada completa · Algo de responsabilidad;Pablo Sanz Esquivel ;https://www.linkedin.com/in/pablo-sanz-esquivel;null;
Desarrollador de JavaScript;UST España & Latam;UST España & Latam  España En remoto hace 2 horas  71 solicitudes;Jornada completa · Algo de responsabilidad;Piero Matriciani Mestanza ;https://www.linkedin.com/in/piero-matriciani-mestanza-19017a101;null;